{
    "$schema": "../../../../conf.schema.json",
    "baseDir": ".",
    "outDir": "../../../output-actual/features/config-glossaries/",
    "includeFiles": ["."],
    "excludeFiles": [
        "**/*exclude*/**"
    ],
    "glossaries": [
        { "file": "./glossary-disjunct-a.md", "termHint": "(a)"},
        { "file": "./glossary-disjunct-b.md", "termHint": "(b)"},
        { "file": "./glossary-common-a.md", "termHint": ""},
        { "file": "./glossary-common-b.md", "termHint": ""}
    ],
    "linking": "relative",
    "ignoreCase": false,
    "dev": {
        "termsFile": "../../../output-actual/features/config-glossaries/terms.json",
        "printInputAst": false,
        "printOutputAst": false
    }
}
