{
    "$schema": "../../../../conf.schema.json",
    "baseDir": ".",
    "outDir": "../../../output-actual/config-tailored/count-term-occurrences",
    "includeFiles": ["."],
    "excludeFiles": [],
    "keepRawFiles": [],
    "glossaries": [
        { "file": "./glossary.md", "termHint": "" }
    ],
    "linking": "relative",
    "ignoreCase": false,
    "dev": {
        "termsFile": "../../../output-actual/config-tailored/count-term-occurrences/terms.json",
        "printInputAst": false,
        "reproducablePaths": true,
        "printOutputAst": false
    }
}
