{
    "$schema": "../../../../conf.schema.json",
    "baseDir": ".",
    "outDir": "../../../output-actual/features/substring_behavior/",
    "includeFiles": ["."],
    "excludeFiles": [],
    "glossaries": [
        { "file": "./glossary.md", "termHint": ""}
    ],
    "linking": "relative",
    "ignoreCase": false,
    "dev": {
        "termsFile": "../../../output-actual/features/substring_behavior/terms.json",
        "printInputAst": false,
        "printOutputAst": false
    }
}
