{
    "$schema": "../../../../conf.schema.json",
    "baseDir": ".",
    "linking": "absolute",
    "baseUrl": "",
    "includeFiles": ["."],
    "excludeFiles": [],
    "glossaries": [
        { "file": "./glossary.md"}
    ],
    "ignoreCase": false,
    "outDir": "../../../output-actual/config-linking/absolute-baseUrl-empty",
    "dev": {
        "termsFile": "../../../output-actual/config-linking/absolute-baseUrl-empty/terms.json",
        "printInputAst": false,
        "reproducablePaths": true,
        "printOutputAst": false
    }
}
