{
    "$schema": "../../../../../conf.schema.json",
    "baseDir": ".",
    "linking": "relative",
    "baseUrl": "http://localhost",
    "includeFiles": ["."],
    "excludeFiles": [],
    "glossaries": [
        { "file": "./glossary.md" },
        { "file": "./sub-1/glossary.md" }
    ],
    "ignoreCase": false,
    "outDir": "../../../../output-actual/features/config-linking/relative",
    "dev": {
        "termsFile": "../../../../output-actual/features/config-linking/relative/terms.json",
        "printInputAst": false,
        "printOutputAst": false
    }
}
