{
    "$schema": "../../../conf.schema.json",
    "baseDir": ".",
    "outDir": "../../output-actual/term-descriptions",
    "includeFiles": ["."],
    "excludeFiles": [],
    "keepRawFiles": [],
    "glossaries": [
        { "file": "./glossary.md", "termHint": "â“•" }
    ],
    "linking": "relative",
    "ignoreCase": false,
    "dev": {
        "termsFile": "../../output-actual/term-descriptions/terms.json",
        "printInputAst": false,
        "reproducablePaths": true,
        "printOutputAst": false
    }
}
